{"canonicalPackSha256":"9cdbb2f0a06f813926dfdb75976e067eabfa3d2aabdc46c94e88b262a61d95cf","claimsSha256":"3050a08fe9ab6778f71d2087e3d271be83b99523979318caaea7ef0fa6907e4a","conflictIds":["approximate-window-endpoints","known-good-object-review"],"conflictsSha256":"d9ec16d3ace4bacabaa2f4a318f248a930f6a46117ed31684363c3d144d47738","expectedFindingsSha256":"fbe293c183939078efd40abc791f2bf58ad4cf9575ffe2325dc19d353e536892","fixtureManifestSha256":"dd31103d974108404b715d193dad16d53d5eb2cf2661b38eeef55d05f4e48fc8","incidentId":"CIR-AQUASECURITY-TRIVY-2026","originalPackSha256":"c758e368cb74c832c03b875dbcf3211122cf38b62f6589aa58b9db1331eac6f8","packSchemaVersion":"cirewind.dev/v1alpha1","packVersion":"1.0.0","preparation":{"authors":[{"databaseId":38338151,"login":"torjan0"}],"preparer":{"databaseId":38338151,"login":"torjan0"},"sourceTranscribers":[{"databaseId":38338151,"login":"torjan0"}]},"reviewPolicyProfile":"trivy-v0.2","reviewPolicySha256":"f38eac698d2bc645ad6ca2783158b5d9904c0b65ed4ba4642d761056d20a78db","reviewUnitPackPath":"pack.yaml","schemaVersion":"cirewind.review-packet/v1alpha1","sourcesSha256":"cc827391549a5ac3258a1c16f1bf74803563e6965c632daf501dc50d3f2a310f","validatorPolicySha256":"ddb2aff301c8d55ad8383701ddf4cb7961973689fe1413a19f127b2f7faf47aa","validatorVersion":"incident-validator-v1alpha1.1"}
