{"canonicalPackSha256":"0a5493027fe3f7b7eb81e1aa2d3fc0e5d1e16e62e765929f9d7ff827ea79c2c3","claimsSha256":"0073d365454bbcc309948d71348ccb6bafb75c1c604f8dd79232c5f2d895ebc3","conflictIds":["patched-version-disagreement","period-date-precision"],"conflictsSha256":"cf9cb7084a46fb0676628904b80e7c1d79908742752d9ecd6257a9826ef99472","expectedFindingsSha256":"779b89f9949737bddeb8d7aadc782d33893adb1f8038a108074ae628d6cc05c1","fixtureManifestSha256":"4aa8f82869f30c22b1b78f729a2fa9a15eefcd7a0b4502eb5945bf5865bc08ae","incidentId":"CIR-TJ-ACTIONS-CHANGED-FILES-2025","originalPackSha256":"783c61a0f734c4bc6dd1564c32cf8b5081e1db7248fe1a31b2b57886b544809b","packSchemaVersion":"cirewind.dev/v1alpha1","packVersion":"1.0.0","preparation":{"authors":[{"databaseId":38338151,"login":"torjan0"}],"preparer":{"databaseId":38338151,"login":"torjan0"},"sourceTranscribers":[{"databaseId":38338151,"login":"torjan0"}]},"reviewPolicyProfile":"standard-v0.2","reviewPolicySha256":"f38eac698d2bc645ad6ca2783158b5d9904c0b65ed4ba4642d761056d20a78db","reviewUnitPackPath":"pack.yaml","schemaVersion":"cirewind.review-packet/v1alpha1","sourcesSha256":"a0dcaf177bca2d5a2915edf409cb3ec522dfc3df5eb17ab3f370a7bdb4e000c0","validatorPolicySha256":"ddb2aff301c8d55ad8383701ddf4cb7961973689fe1413a19f127b2f7faf47aa","validatorVersion":"incident-validator-v1alpha1.1"}
