{"canonicalPackSha256":"402a6335533cb532a68ffc3ec52de332f926610fa10214237b03f054e58e3231","claimsSha256":"ee418a20e7b66f3b340fc909be21cae65c473a5303f23e0f1ee1acfac031e1a7","conflictIds":["retag-object-not-known-good","window-end-minute"],"conflictsSha256":"7c741e5f0720badddcb9ccbff7363e6f12af4e6defda318d2f755da6ee226a60","expectedFindingsSha256":"deabac540e8071bf3d54139b79282a23665d114baec76e99989ab60f033c3d8e","fixtureManifestSha256":"4134989138f7ff562af55f58d32dd806e361982db7173e8bb933a2108a9e7eab","incidentId":"CIR-REVIEWDOG-ACTION-SETUP-2025","originalPackSha256":"05a4b33576f222a2a5a31e24e928f837774e2eec2cd84c88bec3205cf1e47efe","packSchemaVersion":"cirewind.dev/v1alpha1","packVersion":"1.0.0","preparation":{"authors":[{"databaseId":38338151,"login":"torjan0"}],"preparer":{"databaseId":38338151,"login":"torjan0"},"sourceTranscribers":[{"databaseId":38338151,"login":"torjan0"}]},"reviewPolicyProfile":"standard-v0.2","reviewPolicySha256":"f38eac698d2bc645ad6ca2783158b5d9904c0b65ed4ba4642d761056d20a78db","reviewUnitPackPath":"pack.yaml","schemaVersion":"cirewind.review-packet/v1alpha1","sourcesSha256":"d18a5e11b19ba25f3f456ba8b0a47701b8126446fd9e5667c2b14953553eed0b","validatorPolicySha256":"ddb2aff301c8d55ad8383701ddf4cb7961973689fe1413a19f127b2f7faf47aa","validatorVersion":"incident-validator-v1alpha1.1"}
